{
  "$schema": "https://json-schema.org/draft/2020-12/schema",
  "title": "coupon_template",
  "type": "object",
  "additionalProperties": false,
  "properties": {
    "id": { "type": "string" },
    "status": { "type": "string" },
    "created_at": { "type": "string" },
    "updated_at": { "type": "string" },
    "merchant_id": { "type": "string" },
    "merchant_name": { "type": "string" },
    "activity_id": { "type": "string" },
    "activity_name": { "type": "string" },
    "coupon_name": { "type": "string" },
    "coupon_type": { "type": "string" },
    "description": { "type": "string" },
    "terms": { "type": "string" },
    "stock_total": { "type": "integer" },
    "stock_remaining": { "type": "integer" },
    "per_user_limit": { "type": "integer" },
    "need_offline_redeem": { "type": "boolean" },
    "review_status": { "type": "string" },
    "valid_from": { "type": "string" },
    "valid_to": { "type": "string" }
  },
  "required": [
    "id",
    "status",
    "created_at",
    "updated_at",
    "merchant_id",
    "merchant_name",
    "activity_id",
    "activity_name",
    "coupon_name",
    "coupon_type",
    "description",
    "terms",
    "stock_total",
    "stock_remaining",
    "per_user_limit",
    "need_offline_redeem",
    "review_status",
    "valid_from",
    "valid_to"
  ]
}
