{
  "id": "coupon_loveqigu_first_event_welcome_01",
  "status": "APPROVED",
  "created_at": "2026-06-15T09:00:00+08:00",
  "updated_at": "2026-06-15T09:00:00+08:00",
  "merchant_id": "merchant_loveqigu_cafe_01",
  "merchant_name": "爱企谷咖啡馆",
  "activity_id": "activity_loveqigu_first_event_v1",
  "activity_name": "爱企谷初见寻宝节",
  "coupon_name": "爱企谷初见到店礼",
  "coupon_type": "gift_coupon",
  "description": "完成活动探索后可领取的到店礼券。",
  "terms": "每位用户限领 1 张，到店核销一次有效。",
  "stock_total": 1000,
  "stock_remaining": 760,
  "per_user_limit": 1,
  "need_offline_redeem": true,
  "review_status": "APPROVED",
  "valid_from": "2026-06-20T09:00:00+08:00",
  "valid_to": "2026-07-20T21:00:00+08:00"
}
